{
	"items": [],
	"billNumber": 0,
	"buyer": {
		"adress": {
			"num": "",
			"numSuffix": "",
			"city": "",
			"street": "",
			"postCode": ""
		},
		"name": "",
		"vatNumber": ""
	},
	"entreprise": {
		"phone": "",
		"email": "",
		"adress": {
			"num": "",
			"numSuffix": "",
			"city": "",
			"street": "",
			"postCode": ""
		},
		"name": "",
		"vatNumber": "",
		"website": "it works"
	},
	"title": "",
	"date": "",
	"duration": 0,
	"logoURL": "coucou.com",
	"duePercentage": 0,
	"structuredCommunication": ""
}
